{
  "schema_version": "seedcore.component.v1",
  "identity": {
    "part_id": "espressif.esp32-s3-draft",
    "version": "0.1.0",
    "name": "ESP32-S3 board family - illustrative draft",
    "category": "mcu",
    "status": "draft",
    "bom_cost_usd": null,
    "cost_basis": "unknown",
    "supplier_skus": [],
    "notes": "Original simulation proxy only. Dimensions, mass, mounts and interfaces are authoring assumptions, not product specifications. Select a board/SKU and verify drawings, pinout and ratings before hardware qualification."
  },
  "mechanical": {
    "frame": "right_handed_z_up_meters",
    "basis": "simulation_proxy",
    "visual_mesh": {
      "uri": "assets/espressif-esp32-s3-draft.glb",
      "sha256": "9efd4428e80b9a9a74fee20d9bb7c047092de12b123b3ad7a87f92e00c00e6f3",
      "format": "glb2",
      "up_axis": "Y",
      "license": "Apache-2.0",
      "origin": "seedcore_box_proxy"
    },
    "collision": {
      "type": "box",
      "size_m": [
        0.06,
        0.03,
        0.008
      ]
    },
    "mass_kg": 0.025,
    "center_of_mass_m": [
      0.0,
      0.0,
      0.0
    ],
    "inertia_kg_m2": {
      "ixx": 2.0083333333333337e-06,
      "iyy": 7.633333333333334e-06,
      "izz": 9.375e-06,
      "ixy": 0.0,
      "ixz": 0.0,
      "iyz": 0.0
    },
    "snap_ports": [
      {
        "port_id": "mount.bottom",
        "position_m": [
          0.0,
          0.0,
          -0.004
        ],
        "quaternion_wxyz": [
          0.0,
          1.0,
          0.0,
          0.0
        ],
        "mount_standard": "seedcore.proxy_mount_v1",
        "gender": "neutral",
        "qualification": "illustrative"
      },
      {
        "port_id": "mount.top",
        "position_m": [
          0.0,
          0.0,
          0.004
        ],
        "quaternion_wxyz": [
          1.0,
          0.0,
          0.0,
          0.0
        ],
        "mount_standard": "seedcore.proxy_mount_v1",
        "gender": "neutral",
        "qualification": "illustrative"
      }
    ]
  },
  "electrical": {
    "rating_basis": "unknown",
    "min_v": null,
    "max_v": null,
    "continuous_ma": null,
    "peak_ma": null,
    "output_capacity_ma": null,
    "bus_interfaces": [
      {
        "interface_id": "uart",
        "kind": "TTL_UART_BUS",
        "role": "controller",
        "protocol": null,
        "logic_min_v": null,
        "logic_max_v": null,
        "i2c_address": null,
        "pins": []
      },
      {
        "interface_id": "i2c",
        "kind": "I2C",
        "role": "controller",
        "protocol": null,
        "logic_min_v": null,
        "logic_max_v": null,
        "i2c_address": null,
        "pins": []
      },
      {
        "interface_id": "pwm",
        "kind": "PWM",
        "role": "controller",
        "protocol": null,
        "logic_min_v": null,
        "logic_max_v": null,
        "i2c_address": null,
        "pins": []
      },
      {
        "interface_id": "spi",
        "kind": "SPI",
        "role": "controller",
        "protocol": null,
        "logic_min_v": null,
        "logic_max_v": null,
        "i2c_address": null,
        "pins": []
      }
    ]
  },
  "hal_and_safety": {
    "capabilities": [],
    "runtime_binding": null,
    "qualification": "unqualified",
    "hard_limits": {
      "min_rad": null,
      "max_rad": null,
      "max_rad_s": null,
      "max_torque_nm": null
    },
    "simulation_limits": null,
    "execution_authority": "none"
  }
}
