{
  "schema_version": "seedcore.component.v1",
  "identity": {
    "part_id": "generic.lipo2s-draft",
    "version": "0.1.0",
    "name": "2S battery pack (SKU unselected) - illustrative draft",
    "category": "power",
    "status": "draft",
    "bom_cost_usd": null,
    "cost_basis": "unknown",
    "supplier_skus": [],
    "notes": "Original simulation proxy only. Dimensions, mass, mounts and interfaces are authoring assumptions, not product specifications. Select a board/SKU and verify drawings, pinout and ratings before hardware qualification."
  },
  "mechanical": {
    "frame": "right_handed_z_up_meters",
    "basis": "simulation_proxy",
    "visual_mesh": {
      "uri": "assets/generic-lipo2s-draft.glb",
      "sha256": "5401f0a9438cd3c9d87924f17332ef53a092ea504081c0402dbca5b2ea16b93a",
      "format": "glb2",
      "up_axis": "Y",
      "license": "Apache-2.0",
      "origin": "seedcore_box_proxy"
    },
    "collision": {
      "type": "box",
      "size_m": [
        0.06,
        0.035,
        0.018
      ]
    },
    "mass_kg": 0.08,
    "center_of_mass_m": [
      0.0,
      0.0,
      0.0
    ],
    "inertia_kg_m2": {
      "ixx": 1.0326666666666665e-05,
      "iyy": 2.6159999999999997e-05,
      "izz": 3.216666666666667e-05,
      "ixy": 0.0,
      "ixz": 0.0,
      "iyz": 0.0
    },
    "snap_ports": [
      {
        "port_id": "mount.bottom",
        "position_m": [
          0.0,
          0.0,
          -0.009
        ],
        "quaternion_wxyz": [
          0.0,
          1.0,
          0.0,
          0.0
        ],
        "mount_standard": "seedcore.proxy_mount_v1",
        "gender": "neutral",
        "qualification": "illustrative"
      },
      {
        "port_id": "mount.top",
        "position_m": [
          0.0,
          0.0,
          0.009
        ],
        "quaternion_wxyz": [
          1.0,
          0.0,
          0.0,
          0.0
        ],
        "mount_standard": "seedcore.proxy_mount_v1",
        "gender": "neutral",
        "qualification": "illustrative"
      }
    ]
  },
  "electrical": {
    "rating_basis": "unknown",
    "min_v": null,
    "max_v": null,
    "continuous_ma": null,
    "peak_ma": null,
    "output_capacity_ma": null,
    "bus_interfaces": [
      {
        "interface_id": "output",
        "kind": "POWER_RAIL",
        "role": "source",
        "protocol": null,
        "logic_min_v": null,
        "logic_max_v": null,
        "i2c_address": null,
        "pins": []
      }
    ]
  },
  "hal_and_safety": {
    "capabilities": [],
    "runtime_binding": null,
    "qualification": "unqualified",
    "hard_limits": {
      "min_rad": null,
      "max_rad": null,
      "max_rad_s": null,
      "max_torque_nm": null
    },
    "simulation_limits": null,
    "execution_authority": "none"
  }
}
